{
  "required" : true ,
  "$schema" : "http://json-schema.org/draft-03/schema" ,
  "type" : "object" ,
  "properties" : {
    "id" : {
      "type" : "string" ,
      "required" : false
    } ,
    "colorId" : {
      "type" : "string" ,
      "required" : false
    } ,
    "backgroundColor" : {
      "type" : "string" ,
      "required" : false
    } ,
    "foregroundColor" : {
      "type" : "string" ,
      "required" : false
    } ,
    "hidden" : {
      "type" : "string" ,
      "required" : false
    } ,
    "selected" : {
      "type" : "string" ,
      "required" : false
    } ,
    "defaultReminders" : {
      "type" : "array" ,
      "required" : false ,
      "items" : [
        {
          "type" : "object" ,
          "properties" : {
            "method" : {
              "type" : "string" ,
              "required" : false
            } ,
            "minutes" : {
              "type" : "string" ,
              "required" : false
            }
          }
        }
      ]
    } ,
    "notificationSettings" : {
      "type" : "object" ,
      "required" : false ,
      "properties" : {
        "notifications" : {
          "type" : "array" ,
          "required" : false ,
          "items" : [
            {
              "type" : "object" ,
              "properties" : {
                "type" : {
                  "type" : "string" ,
                  "required" : false
                } ,
                "method" : {
                  "type" : "string" ,
                  "required" : false
                }
              }
            }
          ]
        }
      }
    }
  }
}